filename,Title,Top Topic
562_8.txt,mostly story growing relationship jeff webster jimmy stewart ronda castle ruth roman takes instant liking jeff brief encounter deck steamer skagway longer look hides cabin authorities seek charge murder find things common besides animal attraction neither trusts member opposite sex apparently married spouses cheated gradually learn trust journey skagway dawson ronda clearly close dealings corrupt sheriff gannon engages shady practices castle saloon skagway eventually decide gannon jeff meanwhile rene young naive french woman also takes immediate liking jeff gets insulting brush offs return yet sticks travels skagway dawson activities around dawson along ronda nurses back health jeff left dead gannon gunslingers gold claim walter brennan ben serves jeff long time sidekick meaty role serves soften jeff hard edges demise symbolically opens door woman companion replacement jeff john mcintire sheriff gannon makes probably charismatic evil town boss ever see film oozing charm humor go along bullying evidently sees something jeff repeatedly declaring going like makes believable incarnation infamous soapy smith spent last years skagway one premier con men times jeff quintessential antihero loner except companion ben want stick neck others even knows one right man job respect closely resemble burt lancaster character vera cruz example thus jeff turns job marshall dawson convinced leave dawson gannon gang move clear intentions taking everyone insufficiently legal gold claims disposing miners suggesting rest make hurried exit dawson even ronda suggests jeff make hurried exit dawson still alive jeff sudden change heart apparently still nursing desire revenge shooting ben changes anti hero hero leading expulsion gannon gang dawson respect differs lancaster character never reforms jeff truly changed handing revenge wrongs committed interests main problem see plot 2 principle women clearly ronda groomed right woman tame jeff although clearly characterized bad girl jeff checkered recent past shot least 5 men us yukon stolen cattle back gannon ironically soon jeff changes anti hero hero rhonda makes similar change running street warn jeff gannon impending ambush dies result jeff asks look supposedly abandoned creed clear corine calvert renee make credible substitute dead ronda jeff mind yet apparent implication parting scene get together even though jeff never visibly gives kiss hug image good naive young woman somewhat compromised job rhonda saloon bumping miners weighting gold dust pushing spilled dust floor recovering later also unclear relationship rube morris middle aged miner followers around works claim father another problem amateurish handling gun fight jeff gannon gang gannon skill pistol killed seriously wounded jeff boardwalk jeff jeff badly shot right hand suddenly become well enough shoot pistol apparent ease also wonder jeff friends help save avalanche victims much far away pull alive snow ronda pack horses mules also buried avalanche see host probably nameless familiar faces among miners gannon gang sequences shot canadian rockies provide breathtaking backdrop action entertaining western major flaws concentrated end doubt film takes great liberties history geography especially part taking place canadian yukon fact much tamer us skagway,1
563_10.txt,penultimate collaboration director anthony mann star james stewart excluding days mann worked night passage parting company star less amicable circumstances far country belies mainstream look offer another portrait embittered man dragged unwillingly redemption fighting every step way time cattle driver whose response labour problems challenging troublesome cowhands gunfight end trail results cattle confiscated john mcintire larcenous judge roy bean school law order stealing back taking across canadian border soon finds unwillingly drawn growing conflict prospectors judge cheats kills claims great surprise way stewart turns end surprisingly callous critter along way even using desire left alone excuse warning group prospectors impending avalanche chance problem film really hair breadth mcintire something judge recognises immediately revelling company kindred spirit even genially planning lynch many ways townspeople put faith probably recognise despite appeals dead buried better nature unspoken acknowledgement person stand judge someone almost bad usual mann exceptional use high country locations though final showdown takes place level ground film almost perfectly cast strong support walter brennan harry morgan ruth roman though corinne calvert young romantic interest veers irritating sadly great cinematography canadian rockies done favours distinctly average dvd transfer theatrical trailer extra,1
564_8.txt,colorful western wyoming cowboy james stewart moseys yukon territory dig gold sell steers try get date pretty saloon owner ruth roman shake tail crooked sheriff john mcintire wants stewart cattle beautiful cinematography collaborative effort william fritzsche bill daniels good technicolor adventure universal international directed anthony mann also starring corinne calvet connie gilchrist walter brennan stewart sidekick,1
565_10.txt,first rate western tale gold rush brings great excitement romance james stewart screen far country one five stewart mann westerns often overlooked stewart yet puts new look ever present personalities five stewart mann westerns jeff webster stewart uncaring always looking surprised people nice kindly ironically wear bell saddle ride without displays might care one person sidekick ben tatum played walter brennan since tatum one gave mann yet puts new look ever present personalities put five stewart mann westerns displays violence excitement plot twists romance corruption story jeff ben series events wind get rich quick town dawson along gold partners calvet flippen good beautiful roman hired men unable leave crooked sheriff mr gannon mcintire deputies hang since way skagway gannon town eventually mcintire comes collect stewart fine supposedly owes government mcintire cheat miners claims money people killed sheriff dawson considered needed calvet elects stewart good gun stewart however refuses job plans get gold pull also refuses like help people since law order always gets somebody killed flippen elected instead miner killed tries stand one gannon men purely evil mustachioed fancy gunman named madden carries two guns played wilke flippen attempts arrest madden see justice done cannot stand becomes town drunk man named yukon replaces flippen stewart tatum start pull ambushed gannon men tatum killed stewart wounded stewart finally realizes must something gannon take dawson set rules become town like skagway audience also realizes stewart must another thing audience realizes stewart thing stands townspeople gannon stewart leaves gannon would take town stewart stays keeps anything townspeople killed one one mercilessly uselessly great scene occurs stewart walks cabin sling arm seconds gun gunbelt hanging post beside bed gun close stewart background inside door stares seconds tosses sling away sling lands back chair falls floor symbolic throwing away old life consisted caring anybody comes new life helping people need help ends film guns blazing furious show good evil genuinely feel good feeling everything alright,1
566_8.txt,cunningly interesting western director peers genre much like anthony mann pictures far country blends potent pot boiling story adroit knowing impacting scenery play amongst mann peccadilloes like honour integrity betrayal course death story sees fortune hunting partners jeff webster james stewart ben tatum walter brennan travel oregon territory herd cattle aware blossoming gold boom plan make tidy profit selling cattle klondike town arriving skagway find self appointed judge mr gannon john mcintire ready meet justice webster account webster fractured law honest cause along way punishment gannon takes partners herd steal back head across canadian border dawson gannon men hot pursuit beautiful women meek lawless town fill destinies involved interesting start finish far country benefits greatly james stewart bubbling anti hero waiting portrayal mann slick direction tight borden chase script cinematography william h daniels superlative tho done favours current dvd prints film surprises wont core reeling viewers paying dividends watches hardened genre fans still remains something essential viewing first timers venturing wonderful yet dark western world anthony mann james stewart 8 10,1
567_10.txt,jimmy stewart anthony mann teamed best westerns ever made one best real star film however spectacular canadian rockies serve backdrop story best cinematography ever done history film five westerns stewart mann together supporting roles perfectly cast exception right parts might lines characters firmly etched lines stewart cynical hard bitten loner film whose real friend sidekick walter brennan brennan death hands villains makes want finally free gold settlement bad guys incidentally redeem process john mcintire head villain piece appreciated actor vast range could play delightful old codgers authority figures case particularly nasty crafty villain one best westerns ever,8
568_7.txt,stewart wyoming cattleman dreams make enough money buy small ranch utah ranchâ real companion sidekick ben tatum great walter brennanâ accomplish drive cattle clear alaska dawson canadian territory sell along way meet man runs gold crazy town behind dishonest lawman john mcintire attempts steal herd later dawson mcintire gang reappear time interfering stewart gold claim captured mann camera wonderful scenery canadian rockies stewart thoughtful loner forced violence need get rid treacherous actions corrupt entrepreneur robbing local miners claimsâ entertaining beautiful western stewart two leading ladies struggle ruth roman bit valuable describe sexy woman resisting worst vicissitudes territory docile french canadian girl corinne calvet create nice portrait likable girl ability form judgment spontaneous manner stewart lost ostentatious saloon owner wife candidate,1
569_10.txt,river runs based true story two fly fishing brothers norman paul brad pitt craig sheffer whose reverend father tom skerritt strict man whose two passions faith fly fishing sons fine line two story describes slow progression brothers lives lives separate two different paths touching movie narrated director robert redford playing elderly norman reflecting times long gone people long dead certain themes recur movie memory death eternity dreams themes revolve around almost tragic hero paul capable charming brave man fatal flaws closing lines sum point movie arctic half light canyon existence fades soul memories sounds big blackfoot river four count rhythm hope fish rise eventually things merge one river runs river cut world great flood runs rocks basement time rocks timeless raindrops rocks words words haunted waters,0
56_10.txt,one amazing stories ever seen film directed larry clark story school shooting probably would shown eyes killer whatever led person go insane first place instead plot focuses mainly aftermath school shooting effected victims survived seen busy phillips films performance movie far best movie seen erika christensen swim fan made almost want watch film turned good performance one movies seen actually able make cry trust tell happen often home room beautiful film,8
570_10.txt,embarrassingly watched movie first time 13 years release story father brother relate one brother bit wild brother typical older child craig sheffer little unemotional oldest brother pitt amazing skerritt perfectly cast father fishing scenes filmed montana absolutely breathtaking idea fly fishing could attractive movie closely follows book modifications make appropriate movie format unlike book movie stories one measures perfect movie anyone wants quiet night powerful somewhat emotional movie,8
571_10.txt,watching two brothers interact feed whole movie makes personally happy live rural area much like movie watched movie countless times book right beside bible watching movie agree one movies book justice strongly recommend anyone chance go montana fish outdoors amazing think anyone else could play role better brad pitt justice watch one better movies modern movie era strongly recommend guide fishing trips montana wyoming try learn fly fish scenes movie although looks great film idea much practice skill fishing like actually takes thank listening watch movie please would like long sad movie,8
572_9.txt,answer person made comment film drags believed purpose role jess brother response role jess brother provide form dramatic irony story craig sheffer norman could foreseen troubles associated living life full looking jess brother turned various instances brad pitt lives run parallel example jess brother takes craig sheffer disjointed bar subsequently finds brad pitt days later dramatic irony craig sheffer character would bigger emotional turmoil brothers death knowing could done prevent subsequently creates compelling mood film,2
573_9.txt,always enjoyed films depict life life sometimes boring patches real plot necessarily happy ending river runs perfect name film norman maclean novel life ebbs flows like river rough spots wonderful trip robert redford brings lot film narration friendly feel fits picture perfectly director restrained calm captures incredibly beautiful scenes acting craig sheffer brad pitt work surprising well brothers know quite describe tom skerritt brenda blethyn performances except truly feel real river runs wonderful film 8 6 10,2
574_7.txt,academy award winner robert redford best director ordinary people 1980 captures majesty montana wilderness strength american family acclaimed adaptation norman macleans classic memoir craig sheffer stars young norman brad pitt stars brother paul irresistible daredevil driven challenge world growing boys rebel stern minister father tom skerritt norman channels rebellion writing paul descends slippery path self destruction also starring emily lloyd wild hearted jessie burns film academy award best cinematopghaphy 1993,0
575_10.txt,great drama areas covered except screenlay slow shown relevant scenes like pitt character interviewing president pitt getting murdered instead described us scenes like would kept audience awake cutting away useless minutes could made room heartpounding scenes like dragging film kept one time greatness although see pitt makes film worth watching also big fans fising early 20th century styles montana really like well,8
576_10.txt,film brilliant casting location scenery story direction everyone really suited part played could imagine robert redford amazing actor director norman father came scottish island loved fact real connection film witty remarks throughout film great brilliant much bought film soon released retail would recommend everyone watch fly fishing amazing really cried end sad know say cry film must good definitely also congratulations two little boy played part norman paul brilliant children often left praising list think stars play grown big profile whole film children amazing praised done think whole story lovely true someone life shared us,8
577_8.txt,one beautiful films ever seen footage extraordinary mesmerizing times also received oscar best photography deservedly many movies film collection several seen besides many beautifully even equally beautifully shot one unique overall great movie cast terrific great job portraying characters follow destinies devotion get emotionally attached along way also learn things lives think much film represent present warmly recommend,8
578_10.txt,much say movie commentaries page one except jesse says berries page one commentators wrote eloquently almost dialog movie may one illusive things hear much usually made actors deliver lines beautiful script maybe robert redford hold strict sway onto actors actresses filming movie beauty story would get lost attended church young late teens church pastor spoke eloquently quietly rev maclean church totally different picture portrayed southern baptist churches holy rollering church big church many different programs keep congregation busy inspiring perhaps music department huge choir almost classical anthems sunday evening congregation almost entirely younger people even aware safe go church sunday night wish still watching river runs much like going hear beautiful sermon church whose members fully involved life already beautifully written sermon movie open space beauties montana yet also missile silos fly fishing activity draws family members closer together happy life deep understanding one another becomes blessing although see shadier aspects life simplicity story paints lasting impression heart let speakeasies prostitutes counter balanced simple gatherings old fashioned community picnics movie contains heavy contrasts modern families taking kids disney land screeching joyrides calling day together noting wrong river demonstrates taciturn beauty could nothing make life richer third film seen tom skeritt plays father different styles brilliantly acted brad pitt mostly undiscovered talent except thelma louise meet joe black cast members deserved many awards little stories superbly told get 10 10 movie violence foul language ugliness action thinking particularly crash arnold movies savior peace movie,8
579_10.txt,humble opinion movie receive recognition deserved robert redford lives near provo utah sundance enjoy work favorite sorry people appreciate grandmother avid reader read book years came big screen gave read seen movie together movie book hit emotional spot within heart weepy several days seeing movie sometimes love enough keep loved ones hurting see family relationships yet love families stories endure throughout generations time cinematography perfect breathtaking awed beauty well brought life words author book norman maclean alone half light canyon existence seems fade soul memories sounds big black foot river four count rhythm hope fish rise eventually things merge one river runs river cut world great flood runs rocks basement time rocks timeless raindrops rocks words words haunted waters words taken book spoken end movie robert redford narrating norman maclean basically scripture opinion possible flaws movie may overshadowed beauty grace story cinematography beautiful,8
57_10.txt,say one best movies ever seen bored looked v found home room already 5 min got hooked interesting moving shows happen anyone life give 10 possible director writer actors amazing job think teens watch movie learn great drama mystery cried hours think director writer write movies like one loved even know movie sad good wish could go movies people see,8
580_9.txt,first saw movie dad encouraged watch movie one favorites watching movie instantly became one favorites river runs two brothers take different path life norman maclean craig sheffer older two brothers set path education paul maclean brad pitt rebellious younger brother travels path full obstacles movie follows characters follow path downside movie entertained whole way acting directing script perfect two things exceptional cinematography score entrap world robert redford creates around great movie destined classic sure book seen movie definitely watch soon stay forever,8
581_10.txt,river runs one movies deserves seen theater majesty cinematography truly appreciated acting wonderful understated every gesture smile nod carrying meaning brad pitt gives radiant performance tom skerrit powerful preacher father movie moves like river willing follow ebbs flows well worth end,2
582_9.txt,habit always like read hated reviews given movie especially one want comment much point counterpoint sorta deal like see people say flipside however want address one thing many people hated called paraphrase beautiful shallow even going far say norm desire yet inability help brother mundane plot best like disagree brother sibling similar dysfunction relate daily see abuse knowing current path inevitably lead self destruction specifics paul decided take gambling associating questionable folks really wired one hand veritable geniuses painfully self destructive lot like people like howard hughes â forces drive forces tear apart see know worse realize damn thing norman maclean river runs probably way find answer tragedy occur blame end one often takes great deal personal anguish truly come realization sometimes takes lifetime sometimes never comes,8
583_8.txt,little town montana two brothers grow one norman craig sheffer paul brad pitt father reverend maclean grow lessons religion lessons fly fishing movie fly fishing represents life little story good keeps attention although moments need little action probably movie moments really events happen message things happen though norman goes dartmouth study six years returns gets involved nice girl named jessie emily lloyd invited teach chicago paul become reporter known fishing reporter famous seems nice life drinks little much gambles much movie well directed nice score actors good beautiful thing movie cinematography mountains woods river look beautiful movie made things good enough watch fortunately,8
584_8.txt,excellent film dealing life old man looks back years starting around 1910 reminisces boy young adulthood family friends romances etc nostalgic piece bittersweet finale things life come together one river runs river haunts worth seeing,2
585_10.txt,upon seeing film appeared infinitely superior time previous times viewed acting stunningly wonderful characters clearly drawn brad pitt simply superb errant son rebels actors actresses equally fine every respect robert redford creates wonderful period piece days speakeasies 1920s scenery incredibly beautiful mountains streams western montana one finest films made 1990s must see movie,2
586_10.txt,combination reading novella viewing film inspired wife new levels recently pondering statement made artist thomas kinkade one inspirational books states designed breathe fetid air five clock traffic think god banal television programs media hype worthless purchases soul pollution mind created universe seen river runs couple years pondering kinkade statement something drew watch film spiritual eye watched saw whole new world film inspired read book must read always frustrated southern california somehow got caught materialistic society film really puts perspective really experience god creations combination macleans story desire move back northwest driven move montana want future kids able rome landscape go fly fishing ride horses nothing open land serene lakes set mountainside place seldom worry crime look around socal see shopping malls rude snarling people mercedez bens miles vehicles congested freeways gangs racial turmoil verge violent eruption everyone skeptical others intentions anyway movie inspiring brilliant acting deep story fragile connections loved ones lot deep thinking film scenery worth seeing alone actually helps relieve tension finish film relaxed yet full insights life takes compassionate intelligent spiritual person really grasp meaning understand art cinema director achieves goals dialogue tone light colour scenery camera angles movement etc film probably crowd thinks fast furious greatest film granted entertaining shallow bottom line film helps realize life much money things posses rather relationships family friends experiences share together quality qauntity,8
587_10.txt,one things film warmed heart strings dry fly fishing major part scene occasionally carried times dry fly fishing tied flies accompanied brother father spend day one river another seeking tempt ever elusive brown trout rise take fly offered occasions like differences us disappeared pressures world melted away replaced glory absorbed activity surroundings place one amazing things portrayed film minister two sons norman pauly carried ritual something ritualistic fly fishing something ritualistic many pastimes start casting fishing line hope best attune place scan surface water considering flowing best point might place fly depending skill level might even get fly land long enough fish take note strike art fly fishing directed represented well classified artists title film could aptly chosen river fact run life father two sons film however spreads broader family community montana blackfoot river film played capacity draw enthrall capture history family community period unfolded story told family history history life may classified river life,2
588_9.txt,seen films directed robert redford appreciated love american people land river runs redford displays lyric romanticism visual splendor high rocky mountains montana 19th century landscape painter ilk thomas moran albert bierstadt film makes love visual word text author norman maclean stunning camera work phillippe rousselot serpent kiss reigne margot redford cast perfect tom skerritt rev maclean man whose methods education include fly fishing well bible brenda blythen mother sons craig schaffer brad pitt create family whose interactions reflect problems encounter growing teenage sons later complex young men schaffer pitt totally believable brothers whose love fly fishing tie together forever relationships men father sons brothers women outside world grounds river runs vein storytelling missing many hollywood films produced recent years makes relationships special however attention redford gives language spoken dialogue literate script beautiful hear unforgettable coupled stunning montana rivers mountains words setting equal performances cast rises material idea fly fishing may seem odd device center story implausible redford directorial hands given material redford ode simpler time life worth revisiting,0
