filename,Title,Top Topic
798_10.txt,excellent drama suspense whole time could take eyes screen one second every word kept connecting pieces puzzling murder movie really touched showed sad hard life really cry end want give away also let realize cruel sickening people comes murder cast also good bad cast member actress played anne marie actress great job director say found someone look single bit like anne marie fahey,8
799_8.txt,quintessential narcissist manipulator case portraying attorney murderer tom capano kathryn morris sympathetic victim anne marie fahey beginning bit much victim sorry situation become simultaneously disgusted seeing victimization several women including rachel ward well sad part actually getting help self esteem issues capano actually psychologist killed pretty hard believe based true story cameo olympia dukakis excellent capano mother interesting story based true murder want read ann rule book get accurate details 8 10,8
79_10.txt,loved real mc coys 1957 1963 bad lydia reed decided forgotten appear excellent show course walter brennan great well tony martã nez loved called amos seã grampa purchased season dvd cannot wait buy seasons 2 6 would shows television like one everything would better show appeared briefly summer 1999 disappeared god bless departed members cast please llydia reed make known public loved respected real mc coys live forever,8
7_7.txt,although like stanley iris tremendously film admire acting jane fonda robert de niro great movie always fan fonda work delicate strong time de niro ability make every role portrays acting gold gives great performance film great scene take father home elderly people care anymore break heart really recommend film great cinematic entertainment say see much bette acting anywhere,8
800_9.txt,thrilled eight years old back 1983 going see star wars movie theater best day life happen time star wars experience hbo showings star wars even seen empire strikes back yet boy day deliver less critical eyes jabba big rebel spaceships emporer green bladed lightsaber wow since magical day must watched movie hundreds times even form accurate estimate point multiple viewings course observed movie real episode iii flaws course context star wars movie flaws like quirks millions magical day 1977 1980 may 1983 mine star wars movie,8
801_8.txt,suppose jedi chronologically considered last entry popular saga good one several liked directly sequel took empire strikes back appreciated maturity luke skywalker character also mark hamill actor hearing many negative things ewoks bad enjoyed thrilling chase within woods felt lot well realized emotion chapter ending new additions presume successfully weaves 6 chapters wonderful tale fantasy know many true star wars fans hated george lucas changes made original films relative novice movies rather late life missing already know think made 6 movies work perfectly whole entity oh err carrie fisher looked quite delicious skimpy outfit,8
802_10.txt,know know good ending sincerely awesome love movie ends terrific dark nature time impressed darth vader turning emperor really stayed astonished anguishing sequence film luke tortured defeated emperor darth sidious destroyed darth vader dark lord sith eliminates dark master nice sacrifice cinematography film impressive surprised vessels rebel battle ships imperial war ships super star destroyers loved new race brought screen mon calomari ewoks sullesteian lando co pilot many favorite scenes film 1 vader destroys emperor fatally wounded 2 luke sees spirits obi wan yoda shows anakin skywalker sebastian shaw greatest scene star wars 3 leia slays jabba strangling hutt crime lord personally like script battle endor presenting ground space combat well best duel star wars darth vader v luke skywalker death star post script scenes leia slave bikini memorable 9 10,5
804_10.txt,another every star wars fan opinion ii iii opinion biased since missed much atmosphere characters original trilogy state good points return jedi corresponding bad points prequel course loved music special effects two droids overly debated elsewhere get original trilogy particular movie strong ecological concern anti militarist positions fascinating insights jedi order force cute creatures harrison ford smile killer scene near ending vader looks alternatively son emperor lightning lethal bolts reflected black helmet grabs betrays master save luke thereby risking life oh boy wrong prequel inmho whole human factor element original cast able push forward somehow missing force seems superpowers somersaults wisdom many jedis many light sabers screen lack experience actors often threatens coherence plot way enjoy theory force explained obi web obi wen mean yoda read books buddhism forms took ancient japan magic star wars imho lies mainly continuing spiritual heritage master apprentice father son albeit difficulties de mon ã ã ton ã soul would write bejard late zen master deshimaru,5
805_9.txt,return jedi often remembered wrong rather right shame last chronological installment star wars saga shining example epic storytelling manages wrap story lines previous movies one grand finale convincingly yes ewoks cute cuddly bears arguably served broaden star wars demographic middle movie tends slow bit final hour arguably best piece entire saga luke finally comes face face darth vader recognizable villain movie history return jedi many things right people tend overlook presented incredible conclusion darth vader storyline went slightly implausible empire strikes back convincing exciting opening jabba palace masterful performance ian mcdiarmid emperor luke finally coming resolution solo leia romance extremely powerful final moments endor moon yes slight annoyances annoyances generation moviegoers time nitpick every single scene still magical moving piece cinema also serves great final chapter good movie fantastic,5
806_10.txt,star wars episode 4 best star wars ever first movie ever sean bad guys win good ending really wait hing next star wars match stuff comes along movie got find last one whit al lot movies always get feeling could bedder whit one never ever forget part wader tels luke father way cool also love bob feat figure hes back ground player never ever saw star wars movie go one best thanks lucas,8
807_10.txt,dear readers final battle rebellion empire second death star nearing completion completed spell doom rebel alliance luke skywalker jedi knight returns tatooine han solo princess leia revealed luke twin sister agree lead attack shield generator forest moon endor lando calrissian leads attack death star little know ingenious trap laid emperor palpatine personally overseeing construction second death star return jedi favorite original trilogy got action drama romance great battles fantastic acting amazing fight scenes awesome music john williams mark hamill fully matured jedi knight gone naive farm boy place calm relaxed jedi determined save galaxy leia still cool film well han lando 3p0 r2 chewie roles james earl jones still cinema greatest villain darth vader ian mcdiarmid also excellent villain twisted brutally ruthless emperor palpatine action sequences movie breathtakingly amazing sword fights serious gritty john williams score still cool enhances film several levels signed constant dvd collector,5
808_9.txt,wish return jedi directed somebody else mean far much ewoks scenes completely unnecessary besides time heroes look like different people princess leia longer fights solo luke looks boring darth vader evil yoda dies many extraordinary things going episode hate spoilers 1 jabba hut 2 sail barge attack sequence 3 emperor evil 4 speeders chase endor forest 5 last battle 6 dark side seduction scene 7 return anakin good side force 8 last celebration good bring tears eyes scenes would cut another director hired would perfect episode 4 5 still extraordinary 9 10,5
809_10.txt,good movie classic sci fi film humor action everything movie offers greater number aliens see rebel alliance leaders much imperial forces emperor somewhat original character liked ewoks representing somehow indigenous savages vietnamese excellent references loved duel vader luke best saga return jedi epilogue first trilogy empire finally falls also appreciated victory celebration fulfills vader redemption returns hi anakin skywalker spirit along yoda obi wan gives sadness tear greatest scenes star wars among movie vader turns emperor luke watches finds comfort seeing obi wan yoda father 1997 version hayden christenssen next best scene luke rushes strike back darth vader protect leia deep dark side film despite good ending felt much meets eye always john william music bring classicism star wars universe,5
80_9.txt,really enjoyed reunion lot would rated 10 hassie little luke even mention today participate reunion popular characters think mistake give explanation lack appearance anyway glad tnn ran series looking episodes years joy able tape whole series may missed episodes jenny hanahan,8
810_10.txt,probably best star wars movies starting point movie almost like episode iv spacey cabaret music thoughts cabaret place seriousness mobster jabba hutt getting even serious ordered luke die basement pit bone crushing teeth bantha looked almost like cross bear shark luke jedi powers eventually finish monster adding sneaky rescue han solo frozen alive end episode v jabba angry luke sentenced die sarlacc pit outside star wars good guys especially r2 d2 ideas ideas fended luke execution end jabba soldiers died princess leia able use force fatally choke jabba death like episode iv death star episode vi makes appearance analyzed rebel fleet attacking imperial fighters around death star star destroyer personnel guessed sped arming main laser using imperial fighters diversion 20 25 star destroyers lined ready attack called instead laser weapon death star fired surprise fired rebel fleet hope death star deflector shield going knocked affected lando much wanted destroy death star shield taken taken lando increasing impatience like episode v imperial walkers make menacing appearance twin cannons killing least one ewoks ewoks found ancient yet unusual way deal instance chewbacca well another ewok able commandeer one walkers actually used destroy behind one walkers ewoks used logs knock two walkers amazing luke could jedi powers light sabre like instance scene endor luke deflects incoming laser shots storm trooper speeder bike using sabre knock part bike climax using sabre break father arm final sabre fight sith vader probably know ewoks celebration death star blown complete short display fireworks drumming spoils victory e g storm trooper masks luke finally meeting leia luke nemesis darth vader dead burned pyre celebration include ewoks singing think lucas buy even strong respect film composer john williams home movie version think lucas wanted different ending addition celebration endor wanted shots celebratory scenes several surviving rebel planets including celebratory laser shot destroys statue sith ewoks song replaced alternative instrumental piece probably wanted extra stuff prove death star destruction balance restored rebel galaxies,5
811_10.txt,think return jedi think epic yeah ewoks interesting add movie mention similar vietcong also able take technologically advanced army primitive acts jedi definitely darker rest movies emperor palpatine portrayed amazing theater actor ian mcdiarmid one best parts movie palpatine evil vicious vader looks like mr rogers compared speaking darth vader amazing end iconic character vader truly modern day greek tragedy think people especially understand appreciate revenge sith came redemption end moving really brings happy yet bittersweet feeling best part course special effects amazing film early eighties still stand test time graphics scenes jabba palace leia looks amazing metal bikini course epic three way battle end still stunning look jedi deep plot emotional moments primarily luke vader palpatine luke reveals truth leia incredible special effects fitting end one beloved franchises cinema history,8
812_10.txt,babe arms george lucas wowing world world saga chronicling adventures young luke skywalker notorious darth vadar even today 20 years appreciate genius lucas incredible imagination blessed new hope lucas showed new way tell stories introduced us memorable characters plucky princess leia rougish han solo spirited luke skywalker well best loved villains sinister darth vadar empire strikes back went show us special effects add tale managed something one thought could screen made film specific end beginning went treat return jedi fitting end saga stand test time empire srtikes back ended encasing lovable rouge han solo carbonite delivered jabba hut young luke reeling discovery terrible truth father left feeling things going bad worse vadar seemed day asked could rebels ever recover blow lucas stunning captivating final chapter kept edges seats han daring rescue jabba palace final climactic battle death star luke vadar luke struggles fulfilling duties jedi rebel fighter attempting reawaken good believes still father soul old friends like smooth talking lando calrissian ever lovable chewbacca reunite one final battle end battles new darker dangerous enemy emerges form emperor played brilliant ian mcdiarmiud missed oscar mystery desperate turn luke dark side even means betraying apprentice darth vadar black red eyes ghostly white disfigured face sinister laugh truly terrifying addition story undisputed master events unfold new improved death star spells disaster rebels brave group launch one last desperate attack end empire reign good lucas managed incorporate three different stories keep action going audience riveted watch excitement han leia attempt bring shield around death star forest moon endor help adorable ewoks really believe take movie fact feel provide sort reprieve tension battles death star hindered legions stormtroopers imperial officers cheer lando pilots take mighty imperial fleet risk life limb fly deatn star destroy watch bated breath vadar emperor attempt turn luke dark side turn tries turn father back difficult yet compelling battles going inside darth vadar rotj battle emotions feelings vadar caught loyalty emporer empire fatherly inclinations luke never think mask could show emotion one see confusion pain vadar face final scenes emporer turns luke depth emotion vadar believed villain especially one machine man could think makes accessible conflicted apprentice much master victim much villain without ruining end much vadar final scene poignant wonderful trilogy conclusion say george lucas master saga star wars compelling engaging sagas seen long time yet see another saga rival return jedi ingredients necessary provide ending lucas masterpiece deserves action suspense romance tragedy redemption joy rolled one memorable characters wonderful special effects catchy music make great movie right ending lucas proud,5
813_10.txt,empire strikes back return jedi second favorite movie star wars series luke went tattoine save han solo jabba time galactic empire secret construction new space station like previous death star station stays totally constructed end rebel alliance vader emperor impatient delay new death star need kill many commanders project made schedule r2 c3po inside jabba palace send message luke jabba lukes pretends negotiate han life gives r2 c3po gift jabba part plan jabba accept negotiation since using han solo piece palace decoration han still frozen carbonite lando hidden jabba guard chewbacca also gave jabba reward hunter hunter tries save han solo makes stay human form see actually princess leia disguise problem jabba discovers leia plan takes slave han thrown away chewbacca cell luke comes jedi knight rescue friends first try kill jabba falls jabba monster cell bantha easily kills jabba stays angry decides thrown han chewbacca luke sarlacc big creature desert stays 1 000 years digesting food luke han chewie success scape even boba fett dies han accidentally throws sarlacc mouth leia kills jabba goes han luke chewie well c3po r2 everybody safe luke decides go dagoba complete training jedi well promise yoda problem yoda old sick since already 900 years old dies yoda says luke need training really jedi must fight vader confirms luke vader luke dad another skywalker besides luke last moments yoda asks luke remember advices temptation dark side luke transmit jedi knowledge people yoda dies obi wan spirit shows luke tells luke father killed good side anakin become darth vader also machine man since became sith luke stays worried killing dad says feels father still kindness obi wan tells luke twin sister leia says reasons luke leia separated since babies gives last advice luke saying refuses kill vader emperor win war time emperor says vader must give luke shows since luke stronger needs combine efforts bring luke dark side going one best battles star war series rebel alliance plans attack new space station death star 2 luke confront vader emperor leia han chewie needs turn death star 2 power field help ewoks little creatures looks little bears sure one exciting star wars,5
814_10.txt,thanks kevin smith bunch geeks running around saying return jedi good actually fun watch oh muppets involved makes bad everyone liked return jedi someone kevin smith movie made negative comment sudden people people look like kind disease mention much like movie much better anything kevin smith ever even considered creating boggles mind man would even think denouncing movie good fun awesome remember six enjoy movie stop stealing kevin smith opinions correct ewok song end ruled bet people even enjoy ewoks battle endor going set fire,8
815_7.txt,film mind weakest film original star wars trilogy variety reasons however emerges end day winner despite flaws still good film even lot quality depends characters built superior 2 installments one problem look film consistent 2 films put lot departure producer gary kurtz first 2 films dirty lived look technology forth jedi hand even rebels look like stepped shower uniforms dry cleaned makes much less textured film also creatures excessively muppet like cutesy point seems like film makers concerned creating templates future action figures quality film another aspect lack originality star wars created whole new experience cinema empire brought us alien worlds swamps ice clouds jedi lamely cycled locations first film first back desert planet tatooine watching face another death star maybe emperor think anything new think lucas kasdan could also ewoks really detestable made mattel teddy bears recycled version supposed big wookie fight end star wars run cash feels like lazy construction unfortunate aspect jedi weak handling han solo character whereas central plot first 2 films struggling screen time trading one liners droids instead real drama stuck lame pretense han still convinced leia loves luke conclusion empire confessed love never happened whole thing contrived barely conceals fact solo character part film central story rescue ford part looks bored lacks style distinguished earlier performances like 1990s ford performance bored looking film fisher part visibly high scenes lando interesting character introduced empire stuck ostensible person care giant space battle hamill given interesting development luke character really able anything new interesting character probably major actor film still cared work fair script gives lot characters really story characters part package ian mcdiarmid excellent work well emperor film would sink far top times new films visually terms effects work clean look everything hard find fault jabba effective animatronic character one elaborate ever constructed space battles towards end impressive ultimately film coasts success based accomplishments forebears satisfying piece entertainment imho far superior lucas later productions,5
816_10.txt,first like say know share star wars fanatic know many chromosomes wamp rat extended family tk427 know star wars movies less episode 2 though captured something magical hard say button lucas found boldly pressed works star wars movie idea may ask shall explain star wars touches universal stereotypes good vs evil obviously profoundly literally person environment understand episode vi well concluding epic struggle son used manipulated father yet also addition prequels reveals even hinted back story suddenly darth vader front viewers realize story anakin luke even 1 3 amazing depth felt real capsule fell sky lucas lap detailing historical account galaxy far far away star wars definitely something far norm must admit whenever see particularly one feel small feel though thrust world good evil clearly defined get tingling feeling see feeling something somehow touched physical thing could ever hope,8
817_10.txt,thought rotj clearly best three star wars movies find surprising rotj considered weakest installment trilogy many voted seemed like rotj best profound plot suspense surprises emotional especially ending definitely episodic movie personally like empire strikes back lot also think slightly less good rotj since slower moving episodic feel much suspense emotion third movie also seems like reading surprising reviews reasons people cited rotj inferior film two plain ludicrous insignificant reasons compared sheer excellence film whole heard many strange reasons yoda died b bobba fett died c small ewoks defeated band stormtroopers darth vader revealedi would like debunk reasons believe miss point completely first cares bobba fett died george lucas wanted die wanted die get wrong fan bobba fett made cameo appearances lucas intention make central character films star wars fans made name even mentioned anywhere movie go credits find bobba fett name judging rotj minor character died bit much think secondly many fans like yoda dying sure momentous period movie happy see die either makes movie realistic good guys stay alive realistic movie know otherwise good guys lived bad guys died movie would tantamount cheesy saturday morning cartoon another aspect point people liking yoda death well nobody complained darth vader struck obi wan kenobi new hope many consider new hope best trilogy obi wan death okay yoda hmmmmmmmmmmmm another reason believe even stated people found cute ewoks overpowering stormtroopers impossible utterly ridiculous believe one first ewoks native planet endor cognizant home terrain since live watch movie carefully many tactics ewoks used defeating stormtroopers excellent use home field advantage since lived forest life hope would learned use advantage swinging vines ropes logs set trip walkers traps stormtroopers highly disadvantaged outnumbered aware advantages forest thing blasters add like ewoks battling stormtroopers heavily assisted band rebels conquest thought stormtroopers defeated combination star wars heros band rebels well huge clan ewoks great familiarity home terrain would great upset lastly scene still unbelievable empire strikes back new hope several scenes group consisting han solo chewbacca princess shot like ten stormtroopers blasters missed heros full view heroes course always hit stormtroopers blasters troopers must bad aim least empire strikes back battle endor much believable since two armies pitted 3 heroes legion stormtroopers believe check battle cloud city heroes escaping lando base heros rescuing princess leia shot somehow missed han solo luke trying exit death star last reason care discuss others plain ridiculous spend time people like darth vader revealed well many ways major part plot movie luke trying find whether darth vader father annakin skywalker would disappointing movie ended without luke getting see father face made complete annakin revelation symbolized transition darth vader underwent possessed dark side helmet good person annakin skywalker removing helmet point annakin died converted light side meaning helmet removal scene fact would done scene luke father would done wanted see son eyes died mechanized helmet another note think subconscious conscious expectation among people sequel must worse even better preceding movies another reason rotj get many accolades deserves never go film deception mind always try go film attitude well might better worse original know sure let see way go open mind dupe thinking clearly superior film good really sure criticizes movies asked many college students adults favorite star wars movie tell except one person said new hope favorite rotj believe results polls appalling quite misleading bottom line return jedi best trilogy movie one three kept riveted throughout 135 minutes moment boredom scene either suspenseful exciting surprising example emotional light saber battle luke father rotj better one empire strikes back day finally hope people go see phantom menace open mind fans start looking nitpicky insignificant details see another sequel trash movie movie stinks luke meritorious film become another spectacular movie subject derision like rotj suffered unfortunately,8
818_10.txt,return jedi certainly action packed series fine conclusion star wars saga han solo imprisoned jabba hut empire building new death star rebel alliance facing uphill struggle dark side favourite heroes pull opening sequence set tatooine see jabba palace pit slavery scum new home han solo luke gang prepare rescue luke jedi powers edge also witness tremendous triple battle end han leia chewy battle endor desperate deactivate shields protecting death star rebel fleet led lando battle imperial fleet wait shields go luke final showdown darth vader epic end classic saga pace first two 10 10,5
