filename,Title,Top Topic
313_10.txt,black american loved soap opera watched dubbed spanish telemundo almost 5 7 years ago story true story black slave love affair white commander led leadership candid whimsical way living lot us could learn lot xica took nothing saw possibilities many would argue sold trying secure future future children excellent soap opera thought would released dvd released soap opera best soap opera ever need released dvd broadcast tv playing azteca america right available mexico us paid cable need released telemundo,8
314_10.txt,show great history story everything slavery way treated religion ways jews sent hiding inquisition belief orisha african gods way women treated including daughters even homosexuality way characters intertwined violante character saddens desperate loved destroys everyone around glad decided release v although would love see unedited version xica become heroine look way uses power help seek love characters found relate many people century look forward xica every night would great dub english americans love,8
315_10.txt,absolutely loved soap one favorite highly recommend love brazilian soaps deal real life events really sad soap ended sure able find somewhere seen please see loved characters plot things turned end villains thing would changed end xica long life love wait see highly recommend xica far best soap ever seen forget everything else go xica hope like well,8
316_10.txt,xica da silva one best brazilians opera soap ever black slave story becomes queen small villa conquering powerful man area love colonial period brazil dominated portugal explored diamonds largest xica enemy violante bride changed xica woman big influences portugal king close take revenge slave everything religious person picture hypocritical society religious time dedicates life morality villa committed xica woman full lusts faces society time preach helps slaves area story also bill forbidden loves sorceries vampires religious fervor xica da silva want lose surrender beginning end,1
317_10.txt,telemundo definitely consider making dvd collection novela xica know tons people including would like able purchase novela xica entertaining novela set brazil costumes worn actors beautiful town novela takes place beautiful xica contains lot history time period wish telemundo would televise even 2 morning would highly recommend watching xica ever shown telemundo e mailed telemundo million times already show novela pleas fallen deaf ears cautionary statement xica occasionally contains harsh scenes therefore would recommend children 14 watch xica overall xica merits 10 10,8
318_10.txt,without doubt greatest film ever made nearly incomprehensible even many repeated viewings attempt figure exactly going film almost entirely improvised includes random musical numbers commercials contests one enters mail host innovations besides movies cameos martin luther king jr decipher film hunt director book entitled curious become clear grand bold experiment improvised recursive filmmaking triumph someone would put version subtitles color white white subtitles tend wash become invisible,2
319_9.txt,wonderful film mixes documentary fiction way makes spectator question extent truth documentary films thing objective documentary,2
31_8.txt,upon time castle two little girls playing garden castle sisters blonde little girl kitty brunette one evelyn evelyn steals kitty doll kitty pursues evelyn running long corridors reach room grandfather sitting armchair reads newspaper kitty complains evelyn evelyn looking interestedly picture hanging wall evelyn begins say repeatedly red lady kitty black lady suddenly evelyn grabs dagger lying nearby stabs kitty doll cuts doll head fight ensues evelyn almost uses dagger kitty grandfather intervenes worst avoided later grandfather tells legend related picture hanging wall front lady dressed black stabbing lady dressed red long time ago red lady black lady lived castle sisters hated one night jealousy reasons black lady entered red lady room stabbed seven times one year later red lady left grave killed six innocent people seventh victim black lady every hundred years events repeat castle red lady kills six innocent victims killing black lady grandfather ends tale saying according legend sixteen years red queen come kill seven times assures old legend sixteen years pass beginning film many twists surprises film better forget logic really analyse story make sense follow film wonderful colors gorgeous women clothes tasteful decor lighting effects beautiful soundtrack enjoy barbara bouchet sybil danning marina malfatti pia giancaro among goddesses nude sybil danning lying sofa something dream forget lady red kills seven times liked la dama rossa check also la notte che evelyn uscã dalla tomba,7
320_8.txt,curious yellow film near seussical rhyme said right start available two versions yellow blue one big art house hits first major sensation sweden big scandal cause celebre united states one print held customs went way supreme court potent picture today much might offend way revealed sex nudity director actor vilgot sjoman films various scenes way abundance flesh genitalia occasional graphic bit always intellectual expression lust like daring attempt pure metafilm time making true statement state affairs sweden knew things generally peaceful country e usually neutral foreign affairs wars could heated politically least part sjoman aim like filmmaker dusan makavajev works like w r surreal deranged slightly lesser extent bertolucci sjoman mix politics sex mostly politics social strata around midst also making comment embodying character film two characters lena borje hot cold relationship story film lena curious socialist wannabe demonstrates street nonviolence trains sort cabin woods become fully functioning one time maybe curious car salesman boyfriend going enough one movie sjoman inserts crew time time making story film even great bit midway rock concert title cards fill break shooting crew negating use end credits whole dynamic sjoman gives actual performance hey director playing director bit first one might get structure curious yellow film lena documentary interviewer asking subjects thoughts class socialism spain franco see lena father bjore sjoman something interesting structure slippery viewer one stay toes impressive many years picture surprise afraid mix dramatic narrative documentary film within film even serious interview martin luther king also acts quasi guru lena might always completely coherent analysis politically feel cheating even much satirical agenda like godard picture satire sjoman akin godard whole wavelength anarchy playful completely loaded semantics tricks could put less initiated viewer curious yellow stands intellectual enterprise full blown trip exploring sex manner captivating much shown comfortable seems actors entirely successful think emotional experience bergman making purely emotional film deconstruction tendencies sjoman apt connecting specific ideas actually directing always well comes time big subtle scenes actors occasionally works actors lena nyman mostly spectacular performance asks make ambitious confused kid someone sympathetic vulnerable even borje ahlstedt great realistic counterpoint volatile lena 40 years later hard completely connect everything happens inner film lena borje since perhaps intentionally sjoman fills clichã borje girlfriend kid leave lena reconcile father heavy handed narration starlet sorts yet whatever faults sjoman may ironically considering means comment curious yellow holds beautifully artistic experiment testing waters could done swedish cinema testing bending provocative comedic usage even go far say influential probably copied imitated ways one due cult phenomenon time specific technique used film rewinding towards end echoed poorer usage funny games seen anyone looking getting avant garde meta film making quite outstanding artistic leap w r last tango close behind,8
321_10.txt,know film meager rating imdb film accompanied curious blue masterwork thing let film like process film like psychology expecting hardcore pornographic ramming film want watch unwind film want see like masterpiece time attention care summaries may contain spoiler two main thing film blends whole film within film thing way sometimes forget fictions real film like many films one 1 political documentary social system sweden time lot ways still relevant today interviews done young woman named lena 2 narrative filmmaker vilgot sjoman making film deals relationship star film never got involved people supposed work 3 film vilgot making young woman named lena ie 2 young politically active making documentary ie 1 also coming age sexuality freedom magnificence sheer brilliance curious yellow blue three elements cut together one moment watching interview politics next watching interviewer behind scenes well sometimes forget narrative another thing dynamic yellow blue see one must see blue sequel try explain best knowledge films done though great technique think yellow living thing actual events 14 scenes complete tale think blue things 14 scenes yellow see complete tale essentially parallel films story told two different ways saw first 30 minutes blue fully understood yellow hope helpful people discouraged various influences film changed way looked film thanks time,8
322_10.txt,movie porn meant porn unless uncle runs president world never considered porn issue sorted say thoroughly recommend film issues still widely available funny acting great raises serious curious questions fully understand film mistreated probably plan never visit us lena true pioneer modern riot grrrl movement confusion curiosity wit main attributes occasionally angry,8
323_10.txt,truly excellent film revolutionary message form content missed fan french new wave underground film barely opening closing credits dropped world consumerist art revolution youth film little documentary interesting playing ideas advertising relationship reality lines real real crossed ways familiar films discussing documentary time sake consuming marketing describing real,2
324_8.txt,expect like film much got simply saw list top 25 controversial films time look particularly great pleasantly surprised find one cleverly composed films recent memory twenty year old woman wants know everything stores every bit information collects enormous archive experiments experience sex political activism human relationships meanwhile film crew shown making film view reactions story nudity explicit sex controversial politics kept film shown us seizure customs appealed film narrative yet documentary shows us behind scenes world filmmakers narrative fourth wall broken film direct possible way making movie ever seen movie predominantly works time capsule 1960s psychedelic goings freedom fighting sexual liberation like think much think would want waste time blue version movie actually really film buried treasure give try,8
325_9.txt,great film esp compared sometimes wearisome earnestness today politically minded filmmakers film easily combine sex gender relations politics art rarity days bouyant optimism 1960 regained think least learn lesson film breezy energy charm know label film boring watching much packed never remains film 15 min time,8
326_10.txt,jag ã r nyfiken â yellow lot fun like least one reviewer numerous occasions laughing loud yellow energetic playful self aware explorative expect bergman movie youth early mid 60s sweden issues read contradictions nation world facing times yellow appears earnest social political documentary lena main character others interviewing common people politicians e g olaf palme home times yellow seems parody kind documentary yellow acts personal documentary exploring lena life home life loves political views view complete person â complex flawed contradictory happy sad curious placed wonderful additional dimension director sjã man crew documenting documenting lena really gives yellow wings suddenly appear funny times funny ways reminding viewer fiction artifice presence another layer film filming filming reminded bjork music video quality â music video making music video ad infinitum iteration getting weirder cartoonish think sjã man may something similar mind jag ã r nyfiken â yellow may everyone cup tea certainly intelligent witty refreshing ebullient authentic,8
327_8.txt,read one comment labeled film trash wasteof time think person got political undies tugged bittoo much rented new criterion dvd yellow blue films although hardly great least become ofhistorical interest called radical studentpolitical social movement late 60s seen either picture notorious reputation iwas expecting real porn frontalnudity including still verboten frontal male nudity automaticnc 17 orwellian x u expecting filmsin face democratic socialist message though tends simplistic thought occassionally madeits points well films occassionally laughing loudand director commentary made clear plenty ofparody film especially supposedly pornographic sexscenes first scene realistic lead couple isclumsy inept funny endearing first copulation scene second caused complaints fakedcunnilingus fellatio last end angry fight believable extras include informative introduction film aninterview original american distributor attorney excerpts trial testimony u diary commentaryby director scenes film blue noses let alone led thepivotal prurient interest social redeeming value standardthat thankfully still stands interest quirks history find mustsee,8
328_10.txt,fascinating approached curious yellow companion piece great trepidation read numerous reports widely touted controversy explicit sex got thoroughly thought provoking engaging cinema experience unlike sincerely believe majority commenter felt film lame boring approached film pornography perhaps pornography assuming pornography something intended titillate senses intentionally un erotic lena protagonist throws performance giving realistic humanity simply convincing enduring breasts may saggy nipples unusually large thighs fat face chubby end film audience comes identify accept faults human touch gives even believability necessity director cast briget bardot bombshell effect would nullified cannot highly recommend thought provoking piece prepared invest much thought deliberately paced film patient unassuming viewer thoroughly rewarded ways films could dream,2
329_10.txt,versions odyssey greek mythological story matter opinion best almost true original storyline minor deviations omissions e g absence scylla charybdis fact eumaeus swineherd recognizes odysseus disguise hut realistic acting authentic scenery costumes contribute make truly memorable masterpiece hollywoodish sword sandal b flick notwithstanding fact dialogue subtitles completely italian one familiar storyline still make heads tails going actors saying provided good handy text odyssey hand least much inspired study italian language better appreciate movie even,8
32_10.txt,emilio miraglia first giallo feature night evelyn came grave great combination giallo gothic horror second film even better got giallo side equation time around although miraglia lose gothic horror stylings made earlier film delight miraglia puts emphasis finer details plot time around result typical giallo labyrinth characters place red herrings thrown every minutes definite bonus film however get little confusing times always enough hold audience interest miraglia storytelling improved since earlier movie plot opens scene sees two young girls fighting grandfather explains legend behind rather lurid painting castle legend revolves around woman called red queen legend returns grave every hundred years kills seven people years later murders begin occur even though made two giallo miraglia set tributes obvious colour red important features heavily films appears something women called evelyn likes castles gothic atmospheres stylish murders fine miraglia may argento comes spilling blood certainly knows drop top murder film delights involving volkswagen beetle death iron fence one time favourite giallo death scenes female side cast excellent stunning barbara bouchet marina malfatti heading eye pleasing cast ladies afraid take clothes score courtesy bruno nicolai catchy even though feature much psychedelic rock heard night evelyn came grave fits film well ending something turn although miraglia revs gothic atmosphere comes across little bit rushed identity murderer obvious even delightfully entertaining giallo one highly recommend fans genre,2
330_10.txt,italian recently looked film astonished beauty first time 10 years old liked today appreciate adult mind feelings understand masterpiece special season italian cinema pasolini etc time gone hollywood epic films good fun perhaps odyssey english version enough funny suitable pop corn coke audience however suitable homer pathos existentialist reflections italy recently released good dvd version integral excellent colors find file sharing italian without subtitles bad also dialogs voices film remarkable,8
331_10.txt,movie 370 minutes aired italian public television early seventies tells myth attributed homer journey home odysseus troy war epic story ancient minoan mycenaean civilizations told list 500 years events toke place around 1100 bc 1969 movie buy dvd version would find sound mono language italian even close caption italian pity many people would enjoy masterpiece list english subtitles problem would strongly recommend watch movie,8
332_10.txt,although seen mini series twenty years still remember balance character plot tale marvelous adventures succeeded use special effects restrained making poetic rather literal telling story two versions seen dubbed english french actors appear speak language italian synchronization problem spoil story telling among cast irene pappas penelope recognizable north americans recommended followers odysseus ever returning,8
333_10.txt,honesty series much classic television goes original poem world literature far crassly exploitative beautiful respectful rendering one western culture defining texts moved plight odysseus followers touched drama fall troy felt seen intrigued way gods played fate mortals mentioned gods appearing ridiculous cgi creatures flitting around ankle wings poorly cast fashion models bikinis homer work act mortal agents rarely represented classical statuary pity available dvd especially given vastly inferior cheesy adaptations odyssey one find video stores,8
334_10.txt,simple qualify movie pure masterpiece opinion formulated following reasons performance actors seem citizens epoch 1100 b c personalize perfectly characters second reason poetry expressed homere poem well given production among others narrations made chorus give particular atmosphere makes us party artistic rendition third reason reconstitution decor absolutely perfect mediterranean regions action poem occurred emotion rendezvous repeat appreciation pure masterpiece,7
335_10.txt,trying find series ages thank imdb saw child never quite able get mind 6 year old course particularly struck episode cyclops absolutely chilling talked much older brother made cyclops plastic cave man figurine still also remember though atmosphere unusual right beginning mysterious austere extremely authentic read original many years later experienced sensation hard thing capture probably impossible hollywood every odyssey seen since enormous let characters series seemed genuine real people ancient greek people hollywood stars costumes real masterpiece better known available vhs dvd would love chance see,8
336_10.txt,already put best version ever homer epic entirely shot natural locations mediterranean sea sky strikingly blue islands green untouched clothing linen wool fur settings stony bare everything somewhat rugged primitive bit would find cacoyannis pasolini movies makes authentic although story based myths widely goes supernatural gives us good idea life 10th century bc might like rhythm somewhat slow austere whole beautiful quickly get actually amazingly close original plot homer text ulysses appear first hour start centered son looking suddenly appears lost storm lands island pheacians royal family takes good care adventures told flashback narration hosts terrifying cyclop magic world circe underworld sirens etc finally comes back homeland ithaca 20 years ends dramatically killing pretenders faithful spouse penelope story odyssey unparalleled metaphor struggles man life cast brilliant international irene papas gives us typical greek tragedy style performance penelope amazing albanian actor bekim fehmiu ulysses really good looking totally convincing seems role really made strange never offered roles dimension afterwards also playing nausicaa barbara bach barbara gregorini later famous james bond girl spy loved playing athena michele breton otherwise noted strange movie called performance mick jagger done 35 years ago series actually quite innovation time first big european co production tv italy france germany yugoslavia seen mini series 8 parts french television far back 1974 kid back although black white left vivid impression life long wondered would ever get chance see never shown french tv later recently found copy dvd wonderful color internet unfortunately italian subtitles although french german versions existed back never heard english version film widely unknown anglo saxon world quite shame ever get chance watch going forget ever many versions odyssey one camerini 1955 starring kirk douglas classic sword sandal like 10 commandments impressive short complex story one 1997 konchalovsky meretricious hollywood movie based special effects sometimes quite gory poorly acted grossly afar homer story atmosphere,8
337_9.txt,documenting documenter one way describe keep river right modern cannibal tale film follows anthropologist tobias schneebaum late 70s went journey back places spent time participant field researcher 40 years ago first west papua peru tobias full bodied character gay jewish artist anthropologist eeks living cruise ship teaching gawking tourists cultures come deep respect understanding author several books documenting time asmat people west papua cannibalistic amazonians peru tobias haunted happened time places intimate connection relationships become yet tobias constant wonder appreciation places got know admirable real pleasure watch one hope ever achieve retain humility tobias makes compelling subject study experiences faced immersing two tribal societies left fundamentally changed film challenges notions morality naturalness e g nudity homosexuality cannibalism watch graphic circumcision scene questioned engaged local practices others would morally denounce non judgmental nature asks say way cultures right wrong little sleeper must watch national geographic types also interested art documentary making film shows done shot video editing provides quiet revelation tobias life leaves watching fascination times despairs pushed film crew make emotional journey back especially considering age physical frailty grateful tobias allowed tables turned perhaps sympathising desire understand humanity one place world filmmakers provide moments critical balance presenting example one anthropologist believes tobias predetermined findings homosexuality case based personal interests said decide stop shocked take man home cuddle move river queen best river ride taken,8
338_10.txt,saw film amsterdam international documentary film festival privileged meet directors tobias schneebaum lively outspoken new yorkers film title amsterdam keep river right making sensational aspect cannibalism somewhat less prominent equally important loving gay relationship tobias schneebaum members groups studied anthropologist reunion nearly 80 years age inevitable leave taking moving highly recommend film anyone looking moving story anything pedestrian,2
339_10.txt,read schneebaum book title film first published deeply moved ability see many ways otherness people amazon lived loved way living decent life subsequent books powerful showed continuing quest description sexual relations men tribe way ahead time early 60 honesty openness welcome movie beautifully conveys quirkiness generosity man also provides glimpse inevitable destruction innocence morally positive term case occurs civilized men intrude traditional societies even schneebaum moved kind higher innocence suggests possibility saving humanity destructiveness,2
33_7.txt,interesting giallo boosts typical still thrilling plot really sadistic killer obviously likes hunt victims murdering gory ways directed emilio p miraglia one year earlier also made interesting la notte che evelyn usci della tomba see also comment one film starts little slow time wasted unnecessary sub plots sequences film german italian coproduction released germany video version trimmed 15 minutes plot stupid title horror house least murder scenes satisfy every gorehound fully intact viewer still gets killer motive end italian version containing footage still one look course convincing giallo obligatory twists red herrings la dama rossa uccide sette volte highly recommended giallo fans slightly superior miraglia mentioned thriller,7
340_10.txt,loved movie saw febuary 3rd knew buy comes buy july 24th cool deaths scenes hot girls great cast good story good acting great slasher film movies serial killer killing four girls see movies,8
341_10.txt,really enjoyed thriller wanted see soon cast excellent plot suspenseful entertaining overall enjoyable movie would rate one best thrillers ever seen girls really cute also especially denise richards ornery throughout movie gave character oomph,8
342_10.txt,gave 8 received low votes definitely really 5 5 ummm kind bloody likeable shallow characters really hot babes like eclectic killer kill people way everytime sometimes gets old,8
